"soda_id","title","type","description","updated_at","page_views_total","domain_category"
"gqvk-p23x","Official Results General Election Result - 2025","dataset","Final results of the 2025 General Election. Mayoral results by ward and voting station, Councillor results by ward and voting station, School Board results by combined wards and voting station.","2026-04-07T21:31:47.000Z",804,"Government"
"kt4w-gkth","Fall Survey of Calgarians (2023)","dataset","These are the results of 2023 Fall Survey of Calgarians. To see the most recent reports, visit <a href=""https://calgary.ca/citizensatisfaction"">Calgary.ca/citizensatisfaction</a>
For detailed informat","2024-05-23T18:27:28.000Z",800,"Help and Information"
"cq6k-mmku","Tracks - Non-LRT","dataset","The set of railway tracks owned by parties external to The City (i.e. CP, CN) that run through the City of Calgary. This specifically does not include the LRT tracks.","2026-05-19T19:28:35.000Z",793,"Transportation/Transit"
"kt2b-hms4","Municipal Development Plan Primary Transit Network Lines","map","Municipal Development Plan Map 2.
The geospatial information included in the Primary Transportation Network (PTN) map is intended for visualization at a citywide scale. The map provides both direct an","2026-04-01T20:32:37.000Z",792,"Transportation/Transit"
"gbzk-f5ih","Compensation Disclosure List 2015","filter","The City’s compensation disclosure list includes position titles and base salary ranges as approved by Council in 2015.

For more information see http://www.calgary.ca/CA/cmo/Pages/Compensationdiscl","2025-06-18T14:02:32.000Z",790,"Government"
"xvc2-3u78","Census By Ward 2000","dataset","Census data is an official count of dwelling units and population within those units. The data is physically collected and may be supplemented with other information such as the periodic age/gender di","2026-04-06T17:31:07.000Z",790,"Demographics"
"wp8i-idr6","Census By Ward 2008","map","Census data is an official count of dwelling units and population within those units. The data is physically collected and may be supplemented with other information such as the periodic age/gender di","2026-04-07T14:54:06.000Z",787,"Demographics"
"e7ib-v9n4","Suburban Residential Growth (SRG) Forecast","dataset","This dataset provides information of historical absorption and a five year forecast within the planning sectors produced by Growth Analytics for the purposes of the Suburban Residential Growth Project","2026-05-07T14:31:01.000Z",782,"Services and Amenities"
"u3my-59cd","CEI Matrix - Self-perceived Health","map","The Calgary Equity Index is a decision-making tool designed to measure equity in Calgary, based on a social determinant of health (SDOH) framework. The SDOH are the range of interacting social and eco","2023-02-01T15:39:01.000Z",781,"Help and Information"
"g5er-yir2","CMHC Builder's Report - Multi Family - Community Detail","chart","","2026-05-23T19:03:30.000Z",778,"Business and Economic Activity"
"ev3p-fxn7","Census By Ward 2004","map","Census data is an official count of dwelling units and population within those units. The data is physically collected and may be supplemented with other information such as the periodic age/gender di","2026-04-06T19:49:15.000Z",776,"Demographics"
"7zjt-r8du","2017 Mayor Election Results by Ward and Voting Station","chart","This dataset contains the election results by voting station for each Ward in the 2017 General Election.","2026-04-01T16:24:24.000Z",772,"Government"
"dztw-yuke","2018 Citizen Satisfaction Survey","filter","Since 1997, The City of Calgary has conducted its annual Citizen Satisfaction Survey to ask Calgarians how satisfied they are with City performance, programs, services, and overall quality of life in ","2026-01-28T18:08:25.000Z",770,"Services and Amenities"
"vcep-crn9","Prohibited Roads for Temporary Signs","dataset","This dataset identifies the roads in the City of Calgary where temporary signage is prohibited under the Temporary Signs on Highway Bylaw 29M97.","2026-04-30T13:34:34.000Z",769,"Help and Information"
"33tb-fhsv","Calgary Equity Index - Visible Minority","map","The Calgary Equity Index Overlay Statistics are derived from Citizen Satisfaction surveys and census demographics.
The Calgary Equity Index is a decision-making tool designed to measure equity in Cal","2023-02-01T15:38:56.000Z",769,"Demographics"
"h3jk-2j4q","Crosswalk Types","chart","","2026-05-22T20:30:51.000Z",767,"Health and Safety"
"qcug-xuqg","Playground Fall Surface","dataset","Describes the types of Playground (PG) Equipment Fall Surfaces, maintained by Calgary Parks or located on lands under Calgary Parks Stewardship.","2026-05-21T14:20:28.000Z",767,"Recreation and Culture"
"g4a4-wrhr","SDAB Decisions Pie Chart by Property Type","chart","This file lists SDAB decisions since 2014. Additional information about the Subdivision and Development Appeal Board can be found at Subdivision and Development Appeal Board Page on calgary.sdab.ca.","2026-05-21T21:49:29.000Z",767,"Government"
"kmcm-g6mz","Cumulative Migration by Place of Origin (2016 boundaries)","filter","","2024-06-24T19:56:40.000Z",765,"Government"
"7uyz-jgnh","Forward Sortation Area 2011","dataset","The Forward Sortation Area Boundary File depicts the boundaries of forward sortation areas (FSAs) derived from postal codes captured from federal census questionnaires. This is based on census dissemi","2023-02-01T15:39:24.000Z",765,"Base Maps"
"gty4-ir2u","Residential and Non-Residential Building Permit Value","chart","This monthly report contains comments, analysis and statistical illustrations of a set of economic indicators monitored by Corporate Economics that inform our forecasts.","2026-05-22T10:00:22.000Z",765,"Business and Economic Activity"
"fydv-pihp","2025 CCSD By-election station-by-station official results","dataset","Election Day station-by-station results for the 2025 CCSD By-election.","2026-04-01T18:41:32.000Z",765,"Government"
"a84c-t6j3","Snow Route Parking Bans","dataset","During a snow route parking ban, parking is temporarily restricted on designated snow routes for up to 72 hours. Blue signs with a white snowflake are posted along snow routes. This dataset shows line","2025-10-08T21:38:45.000Z",762,"Help and Information"
"i89d-xgp7","Planting Beds (Maintained as per LMA)","dataset","Describes the types of Planting Areas, beds or container locations, maintained by Calgary Parks or located on lands under Calgary Parks Stewardship. They include Shrub beds, flower beds (annual and/or","2026-05-22T15:16:05.000Z",760,"Services and Amenities"
"6nu3-wt4w","Finance Investment Returns","dataset","This dataset contains Finance' investment return ratings","2023-02-01T15:39:21.000Z",754,"Government"
"vx7i-imww","Tuesday March 30 SW","map","To look up your address, download a calendar, or get a reminder for your next pickup date, visit:  <a href=""http://www.calgary.ca/UEP/WRS/Pages/Garbage-collection-information/Residential-services/Garb","2026-05-22T23:43:07.000Z",744,"Services and Amenities"
"94wb-umnh","Parks Water Features","dataset","This dataset identifies the man-made Water Bodies on lands under Calgary Parks Stewardship.","2026-05-21T14:17:09.000Z",743,"Recreation and Culture"
"b5q8-82zn","2021 Federal Census Employment by Ward","dataset","The Employment data from the 2021 Federal Census covers labour force status, employment status, labour force participation rate, industry, and occupation. For questions, please contact socialresearch@","2024-10-11T17:53:58.000Z",743,"Demographics"
"7zgx-yfi7","2018 Snow and Ice Requests in Wards (Bylaw)","map","Public Service Requests submitted via 311 from 2012 to present. 

For more information on 311 Calgary, or to submit a request, visit http://www.calgary.ca/CFOD/CSC/Pages/311.aspx","2026-05-23T17:01:11.000Z",743,"Services and Amenities"
"y6yw-56qu","Calgary Equity Index - Transit to Work","map","The Calgary Equity Index Overlay Statistics are derived from Citizen Satisfaction surveys and census demographics.
The Calgary Equity Index is a decision-making tool designed to measure equity in Cal","2023-02-01T15:38:58.000Z",742,"Demographics"
"ghqn-3yus","2018 Vote of the Electors Unofficial Results by Ward","filter","","2026-04-01T16:44:25.000Z",742,"Government"
"agnj-eh2q","Pets Impound Outcomes Annually","chart","Impounded cats and dogs are animals sheltered at the Animal Service Centre because they were running at large in their communities, a violation under the Responsible Pet Ownership Bylaw. A cat or dog ","2026-05-12T20:06:27.000Z",740,"Services and Amenities"
"kzuk-8i2d","Census By Ward 2009","map","Census data is an official count of dwelling units and population within those units. The data is physically collected and may be supplemented with other information such as the periodic age/gender di","2026-04-07T15:07:20.000Z",739,"Demographics"
"299k-kwmq","Airport Vicinity Protection Area","map","This dataset outlines the boundaries of the Airport Vicinity Protection Area. For more information, visit http://www.calgary.ca/PDA/pd/Pages/Calgary-Land-Use-bylaw-1P2007/Airport-vicinity-protection-a","2023-02-01T15:38:49.000Z",732,NA
"4h2x-es9i","Suburban Residential Growth (SRG) Regions and Municipalities","dataset","This dataset includes regions and municipalities within the Calgary Census Metropolitan Area and the Calgary Economic Region for the Suburban Residential Growth Project. The data is refreshed twice a ","2026-05-07T14:36:33.000Z",728,"Services and Amenities"
"ievp-qtfg","Calgary Public Library Tours And Outreach Programs 2014","dataset","Calgary Public Library offers four types of Library tours. Each one provides you with a different experience of the Library and its resources.","2023-02-01T15:39:24.000Z",726,"Recreation and Culture"
"xa96-xr34","General Election 2021 - Daylight Saving Referendum by Station","dataset","Referendum voting station results of the 2021 Election. Daylight Saving Referendum by voting station.","2026-04-07T19:34:14.000Z",723,"Government"
"6ue7-ygzk","Parks Cemeteries","dataset","The City of Calgary operates five cemeteries and one indoor mausoleum. Related information: 
http://www.calgary.ca/CSPS/Parks/Pages/Cemeteries/home.aspx","2026-05-04T19:30:01.000Z",718,"Services and Amenities"
"immi-c5nn","Tree Canopy 2017","dataset","Tree Canopy contains polygons outlining the extent of tree cover for all land within the City of Calgary. The tree canopy was derived by Remote Sensing software using City of Calgary Orthophotos and L","2026-05-19T21:12:23.000Z",717,"Environment"
"rieu-dj9d","Parks Signage","map","This dataset provides information about the signs associated with the usage, regulation and information about Calgary Parks' assets.","2026-05-22T22:01:09.000Z",714,"Help and Information"
"gmzj-skfj","Top 10 Migration origins to Calgary (2016 boundaries)","chart","Interprovincial and intraprovincial migrants, by census metropolitan area and census agglomeration of origin and destination, 2016 boundaries.","2024-06-24T19:57:21.000Z",713,"Government"
"kji3-kmu4","Annual Resident Count by Dwelling Type","chart","Ward-level tabulations of annual census counts of residents, dwellings, and dwelling occupancy, categorized by dwelling structure type. Ward boundaries can change over time. These results are based on","2026-04-01T20:24:11.000Z",712,"Demographics"
"abmn-5hw9","Parks Monuments","map","Monuments maintained by Calgary Parks or located on lands under Calgary Park’s stewardship.","2026-05-21T14:10:26.000Z",711,"Recreation and Culture"
"qxyx-9nxm","2018 Snow and Ice Requests in Wards (Bylaw, Parks, Roads)","map","Public Service Requests submitted via 311 from 2012 to present. 

For more information on 311 Calgary, or to submit a request, visit http://www.calgary.ca/CFOD/CSC/Pages/311.aspx","2026-05-23T17:01:11.000Z",708,"Services and Amenities"
"kqjb-e98t","Census By Ward 2015","map","Census data is an official count of dwelling units and population within those units. The data is physically collected and may be supplemented with other information such as the periodic age/gender di","2026-04-07T16:30:38.000Z",705,"Demographics"
"ijd2-3nw8","Parks Administrative Boundaries","dataset","The administrative areas and managers for Calgary Parks based on the administrative community layer.","2026-05-05T14:56:34.000Z",705,"Recreation and Culture"
"8efa-as6u","Tree Canopy 2012","dataset","Tree Canopy contains polygons outlining the extent of tree cover for all land within the City of Calgary. The tree canopy was derived by Remote Sensing software using City of Calgary Orthophotos and L","2026-05-20T13:56:35.000Z",702,"Environment"
"b7du-6647","Tracks - Non LRT Centre Line","dataset","The centre line depiction for railway tracks owned by parties external to The City (i.e. CP, CN) that run through the City of Calgary.","2026-05-20T13:48:01.000Z",699,"Transportation/Transit"
"8y6g-m4m7","Builders Report - One and Two Family - City Summary","chart","","2026-05-23T19:03:30.000Z",696,"Business and Economic Activity"
"fhmw-xp86","2013 Election Results by Voting Station","dataset","Final results of the 2013 General Election by Voting Station.","2026-04-01T15:32:53.000Z",693,"Government"
"ejif-sbc3","Census By Ward 2010","map","Census data is an official count of dwelling units and population within those units. The data is physically collected and may be supplemented with other information such as the periodic age/gender di","2026-04-07T15:52:41.000Z",690,"Demographics"
"5m8t-ar4t","Plus 15 Bridges","map","Bridges within Calgary's Plus 15 Network. For more information visit <a href=""https://www.calgary.ca/plus15"">Calgary.ca/Plus15</a>","2026-05-01T17:00:46.000Z",680,"Transportation/Transit"
"ue7k-y2pd","Calgary Public Library Program Information 2014","dataset","Contains the number of Calgary Public Library programs and attendance for 2014.","2023-02-01T15:39:24.000Z",679,"Recreation and Culture"
"rpd7-v3tx","SDAB Appeals by Property Type","chart","This file lists SDAB decisions since 2014. Additional information about the Subdivision and Development Appeal Board can be found at the Subdivision and Development Appeal Board page on calgary.sdab.c","2026-05-21T21:49:29.000Z",679,"Government"
"8yqe-f4ec","Builders Report - Multi Family - Community Summary","chart","","2026-05-23T19:03:30.000Z",675,"Business and Economic Activity"
"f39w-zwp3","2025 Year-End Progress Report - Performance Measures","dataset","The City of Calgary's 2025 Year-End Progress Update provides an overview of our achievements and challenges as we continue implementing the 2023-2026 Service Plans and Budgets.

- Performance measures","2026-05-04T20:52:18.000Z",674,"Business and Economic Activity"
"ksvf-qk9y","ARB Annual Stats","chart","This data set contains information on decisions made by the Assessment Review Board (ARB).","2026-04-01T20:36:29.000Z",672,"Government"
"8u9v-6mxa","Builders Report - One and Two Family - City Summary","filter","","2026-05-23T19:03:30.000Z",661,"Business and Economic Activity"
"mhqb-ca5d","Calgary Eats Farm Stand Program Locations","map","Points of sale of local produced food in Calgary.  This is part of the Calgary EATS! Food Action Plan endorsed by City Council in 2012.","2026-04-01T20:00:49.000Z",661,"Services and Amenities"
"am4g-kdk6","CEI Matrix - Economic Opportunity Domain","filter","The Calgary Equity Index is a decision-making tool designed to measure equity in Calgary, based on a social determinant of health (SDOH) framework. The SDOH are the range of interacting social and eco","2023-02-01T15:38:57.000Z",659,"Help and Information"
"n4vp-3exq","Suburban Residential Growth (SRG) Forecast Map","map","This dataset provides information of historical absorption and a five year forecast within the planning sectors produced by Growth Analytics for the purposes of the Suburban Residential Growth Project","2026-05-07T14:32:13.000Z",659,"Services and Amenities"
"tdtb-wrps","General Election 2021 - Councillor by Ward (Advance Vote)","dataset","Advance voting station results of the 2021 Election. Council results by ward and voting station.","2026-04-07T19:27:25.000Z",654,"Government"
"wkfs-f9t2","Planting Beds Locations (as per LMA)","map","Describes the types of Planting Areas, beds or container locations, maintained by Calgary Parks or located on lands under Calgary Parks Stewardship. They include Shrub beds, flower beds (annual and/or","2026-05-22T15:16:05.000Z",654,"Services and Amenities"
"sr9i-q3av","Calgary Equity Index - Drive to Work","map","The Calgary Equity Index Overlay Statistics are derived from Citizen Satisfaction surveys and census demographics.
The Calgary Equity Index is a decision-making tool designed to measure equity in Cal","2023-02-01T15:38:54.000Z",653,"Demographics"
"txkg-2z7t","Station 22 - Ogden Daily Rainfall","chart","This is a measure of the raw rain data accumulated at various rain gauges throughout the City during the rain season, which typically runs from May 1- Sep 30. Readings are taken at 5 minute intervals,","2026-05-24T07:35:25.000Z",653,"Environment"
"ez36-5de4","Builders Report - Multi Family - Community Summary","filter","","2026-05-23T19:03:30.000Z",653,"Business and Economic Activity"
"6bev-z2q5","CEI Matrix - Total Equity Score","filter","The Calgary Equity Index is a decision-making tool designed to measure equity in Calgary, based on a social determinant of health (SDOH) framework. The SDOH are the range of interacting social and eco","2023-02-01T15:39:02.000Z",653,"Help and Information"
"nvuz-qykn","Traffic Volumes for 2017","dataset","The traffic volume flow map illustrates the Average Annual Weekday Traffic (AAWT), the average number of vehicles in 24 hours adjusted for seasonal variation to represent the average weekday. The numb","2023-02-01T15:39:34.000Z",653,"Transportation/Transit"
"mmck-7yr8","Green Cart Waste Composition 2020 By Material","chart","Waste Composition studies are periodically conducted by Waste and Recycling Services to help assess the performance of diversion and education programs and inform improvements and new program design. ","2023-02-01T15:39:35.000Z",652,"Help and Information"
"bqtn-vc2c","1:35 Flood Map (2.9% chance of occurring in any year)","map","(Note: Updated inundation maps for 1:2 to 1:1000 floods are available from Alberta Environment and Parks (2020). The new draft maps can be viewed here: https://floods.alberta.ca/?app_code=FI&mapType=D","2023-06-12T17:52:14.000Z",648,"Environment"
"52zb-xa6s","General Election 2021 - Mayor by Ward (Advance Vote)","dataset","Advance voting station results of the 2021 Election. Mayor results by ward and voting station.","2026-04-07T19:57:47.000Z",642,"Government"
"fa2r-5t79","Residential Waste Diverted from Landfill Through Blue and Green Cart Programs","chart","Waste & Recycling Performance Measures are used to assess the performance of The City of Calgary's Waste & Recycling service.  Five measures have been approved for the 2023-2026 Service Plans and Budg","2026-05-13T22:15:49.000Z",641,"Help and Information"
"m2q8-sk4i","CEI Matrix - Diabetes Prevalence","map","The Calgary Equity Index is a decision-making tool designed to measure equity in Calgary, based on a social determinant of health (SDOH) framework. The SDOH are the range of interacting social and eco","2023-02-01T15:38:55.000Z",640,"Help and Information"
"a9yy-jegv","Incidents by Year","chart","This dataset contains daily count of incidents responded by incident type.","2024-11-25T21:43:20.000Z",636,"Government"
"4uie-p5fg","Parks Water Delivery Coverage","dataset","Identifies the coverage area of the Irrigation system (WATER DELIVERY SYSTEM) maintained by Calgary Parks or located on lands under Calgary Parks Stewardship.","2026-05-21T14:19:30.000Z",633,"Recreation and Culture"
"qe4n-g76r","Census By Ward 2017","dataset","Census data is an official count of dwelling units and population within those units. The data is physically collected and may be supplemented with other information such as the periodic age/gender di","2026-04-07T16:41:32.000Z",629,"Demographics"
"prtj-9a43","Pets Impound Outcomes Pie chart","chart","","2026-05-12T20:06:27.000Z",628,"Services and Amenities"
"mjit-gete","Ward Boundaries 2013-2017","dataset","This dataset reflects the Ward Boundaries that were in affect from October 21, 2013 until October 16, 2017.  A ward is the division of the city into electoral areas, each represented by one elected Co","2026-04-08T17:03:54.000Z",626,"Government"
"hdh8-zy77","Calgary Public Library Catchment Areas","dataset","Identifies the catchment areas for the Calgary Public Library.","2023-02-01T15:39:23.000Z",626,"Base Maps"
"8v7a-kjgy","Census By Ward 2007","map","Census data is an official count of dwelling units and population within those units. The data is physically collected and may be supplemented with other information such as the periodic age/gender di","2026-04-07T14:53:06.000Z",625,"Demographics"
"p43y-ph2y","ARB Data Lens","story","<div><br></div>","2023-08-16T20:41:45.620Z",621,NA
"w5hc-kvum","General Election 2021 - Fluoride by Ward (Advance Vote)","dataset","Vote of the Electors voting station results of the 2021 Election. Fluoride results by ward and voting station.","2026-04-07T19:52:58.000Z",620,"Government"
"iric-4rrc","Monthly Solar Energy Production (KWh)","dataset","The monthly output at each of The City of Calgary's solar photovoltaic projects. For information about each site.  visit <a href=""https://www.calgary.ca/environment/policies/solar-energy.html"">calgary","2026-05-01T15:02:23.000Z",619,"Environment"
"u7sr-kvzj","Civic census 2014 - Modes of Travel to Work","dataset","Trends in Calgarians’ choices for travelling to work, and to determine if major infrastructure changes have resulted in a change in behaviour.","2023-02-01T15:39:32.000Z",618,"Transportation/Transit"
"s6pd-q354","Census By Ward 2005","map","Census data is an official count of dwelling units and population within those units. The data is physically collected and may be supplemented with other information such as the periodic age/gender di","2026-04-06T20:02:14.000Z",616,"Demographics"
"d52x-nvay","Calgary Public Library Tours And Outreach Program Attendance 2014","dataset","Calgary Public Library offers four types of Library tours. Each one provides you with a different experience of the Library and its resources.","2023-02-01T15:39:24.000Z",608,"Recreation and Culture"
"3wfx-q8xd","1:2 Flood Map (50% chance of occurring in any year)","dataset","(Note: Updated inundation maps for 1:2 to 1:1000 floods are available from Alberta Environment and Parks (2020). The new draft maps can be viewed here: https://floods.alberta.ca/?app_code=FI&mapType=D","2023-06-12T16:36:38.000Z",607,"Environment"
"msye-bzwu","Annual Corporate Energy Use by Bus Units","chart","Energy consumption at City facilities. This raw data is subject to periodic adjustments and modifications.","2026-05-01T11:36:02.000Z",606,"Environment"
"acjs-ugj2","Calgary Equity Index - Indigenous","map","The Calgary Equity Index Overlay Statistics are derived from Citizen Satisfaction surveys and census demographics.
The Calgary Equity Index is a decision-making tool designed to measure equity in Cal","2023-02-01T15:38:55.000Z",605,"Demographics"
"8rhb-7bun","Calgary Equity Index Ranges Summary","filter","","2023-02-01T15:39:51.000Z",604,"Help and Information"
"2u52-b8mx","Multi Family Garbage Composition","filter","Waste Composition studies are periodically conducted by Waste and Recycling Services to help assess the performance of diversion and education programs and inform improvements and new program design. ","2025-02-28T21:13:47.000Z",602,"Help and Information"
"56up-4ui9","Census By Ward 2002","map","Census data is an official count of dwelling units and population within those units. The data is physically collected and may be supplemented with other information such as the periodic age/gender di","2026-04-06T19:27:47.000Z",601,"Demographics"
"f2h8-nduu","Calgary Public Library Program Information 2015","dataset","Contains the number of programs, tours and outreach programs by branch for 2015","2023-02-01T15:39:24.000Z",599,"Recreation and Culture"
"mnxn-xre9","Calgary Language Ward Map","map","","2023-02-01T15:39:50.000Z",597,NA
"widw-jg49","Builders Report - One and Two Family - Community Summary","chart","","2026-05-23T19:03:30.000Z",596,"Business and Economic Activity"
"re3g-j9hq","2018 Citizen Satisfaction Survey - Perception of Services","filter","The source of this data is the 2018 Citizen Satisfaction Survey, a telephone survey conducted with a randomly selected sample of n=2,500 Calgarians aged 18 years and older between August 15th and Sept","2025-02-28T21:13:59.000Z",596,"Services and Amenities"
"wz77-hq7u","1:500 Flood Map (0.2% chance of occurring in any year)","map","(Note: Updated inundation maps for 1:2 to 1:1000 floods are available from Alberta Environment and Parks (2020). The new draft maps can be viewed here: https://floods.alberta.ca/?app_code=FI&mapType=D","2023-06-09T21:22:12.000Z",593,"Environment"
"x3qp-v97g","Census by Ward 2019","map","Census data is an official count of dwelling units and population within those units. The data is physically collected and may be supplemented with other information such as the periodic age/gender di","2026-04-07T17:12:31.000Z",591,"Demographics"
"4c8i-ruhm","Census By Ward 2016","dataset","Census data is an official count of dwelling units and population within those units. The data is physically collected and may be supplemented with other information such as the periodic age/gender di","2026-04-07T16:35:41.000Z",584,"Demographics"
