"soda_id","title","type","description","updated_at","page_views_total","domain_category"
"yn8y-gy24","Voting Subdivisions","map","The voting subdivision defines the area served by a voting station which is where an elector casts his/her vote. It is an area of a local jurisdiction or ward designated as a voting subdivision by the","2026-04-08T16:26:40.000Z",4063,"Government"
"c6ee-wk9g","Transit LRT Stations Map","map","","2026-05-01T11:00:30.000Z",4035,"Transportation/Transit"
"hueq-ytym","Annual Rainfall by Channel","chart","This is a measure of the rain accumulated at various rain gauges throughout the City during the rain season, which typically runs from May 1- Sep 30. Readings are taken at 5 minute intervals, and upda","2025-03-27T20:59:14.000Z",4028,"Environment"
"3x6m-4vs7","City of Calgary Newsroom","dataset","This is an aggregate news feed from a number of City sources.","2026-05-23T20:06:05.000Z",4012,"News and Events"
"pm3p-838w","Calgary Transit Stops By Route Cross Reference","dataset","This table relates Calgary Transit stops to Calgary Transit routes. The data source is the General Transit Feed Specification (GTFS) available on the City of Calgary Open Data which is released by Cal","2026-05-24T16:06:32.000Z",4009,"Transportation/Transit"
"kc8x-fu3f","Water Quality Monitoring Sonde Data","dataset","This dataset is compiled from The City of Calgary’s in situ (in location) water quality monitoring program. In situ field measurements are acquired from the deployment of multi-parameter sondes in sur","2026-05-22T18:32:10.000Z",3957,"Environment"
"5ajn-7mmh","General Election 2021 Results by Voting Stations","chart","Final results of the 2021 General Election. Mayoral results by ward and voting station, Councillor results by ward and voting station, School Board results by combined wards and voting station.","2026-04-07T20:18:38.000Z",3948,"Government"
"2bwu-t32v","Speed Limits","dataset","This dataset lists the maximum speed limits throughout Calgary. It does not list the default residential speed limit of 40 km/hr, which was reduced from 50 km/h to 40 km/h effective May 31, 2021. This","2026-05-01T19:01:36.000Z",3934,"Health and Safety"
"n625-9k5x","City of Calgary Events","dataset","Public meetings, engagement, recreation, and other events around the City. This file is only updated twice daily: in the morning and afternoon. 
For instant RSS notification, see:
https://www.trumba.c","2026-05-24T06:20:31.000Z",3934,"News and Events"
"ycsw-mmzd","Daily Rainfall Totals in 4 locations (NE,SW,SE,NW)","chart","This is a measure of the raw rain data accumulated at various rain gauges throughout the City during the rain season, which typically runs from May 1- Sep 30. Readings are taken at 5 minute intervals,","2026-05-24T07:35:25.000Z",3901,"Environment"
"rkvn-tce9","Historic City Limits","map","The boundaries of Calgary from 1884-present. <a href=""https://data.calgary.ca/d/7t9h-2z9s"">Click here to see just the current city limits.</a>","2023-02-01T15:38:53.000Z",3896,"Base Maps"
"g66w-ixv9","2017 Election Results by Voting Station","chart","Filter the results by office, ward, or voting station.","2026-04-01T15:34:47.000Z",3886,"Government"
"xeek-u7v8","Calgary Equity Index Matrix","dataset","The Calgary Equity Index is a decision-making tool designed to measure equity in Calgary, based on a social determinant of health (SDOH) framework. The SDOH are the range of interacting social and eco","2023-02-01T15:38:55.000Z",3855,"Help and Information"
"7zdt-jpt4","Building Permits and Zoning","map","Building permit applications made to The City of Calgary's Planning & Development department. Visit the Calgary.ca <a href=""http://www.calgary.ca/PDA/pd/Pages/Permits/Building-permits/Building-permit-","2026-05-23T19:03:30.000Z",3832,"Business and Economic Activity"
"gcw3-s66r","Total Number of Licensed Pets","chart","All cats and dogs over three months of age and residing in Calgary must be licensed with The City of Calgary. If you do not license your cat or dog, you could face a $250 fine.","2026-05-12T20:05:58.000Z",3822,"Services and Amenities"
"j3yz-fb4u","Community Boundaries 2011","dataset","A community district is a fixed boundary within Calgary, created by and for the Corporation. It represents a distinct geographical area of the city that is determined through the Land Development/Subd","2026-04-07T19:22:46.000Z",3808,"Base Maps"
"8im8-nvjq","Compensation Disclosure List 2023","filter","The City’s compensation disclosure list includes position titles and base salary ranges as approved by Council in 2023.

For more information see: <a href=""https://www.calgary.ca/ca/city-manager/compe","2025-06-18T14:02:32.000Z",3802,"Government"
"shzx-2b3s","Police Districts","map","Each District has a district office. These districts can be used to calculate information submitted by investigators on criminal activity. The crime statistics can be used to develop crime prevention ","2026-05-13T20:17:30.000Z",3798,"Health and Safety"
"myiv-ju9n","Assessment Review Board Complaints","dataset","This dataset contains decisions, mutual agreements, withdrawals and assessment amendments. For more information on the Calgary Assessment Review Board (ARB) please visit: <a href=""https://www.calgarya","2026-04-01T21:08:31.000Z",3794,"Government"
"2kp2-hsy7","Public Art","dataset","Information about artworks in The City of Calgary Public Art Collection, including locations, titles, artists, and descriptions of the artwork.

For more information, visit: www.calgary.ca/publicart","2026-05-02T01:01:22.000Z",3742,"Recreation and Culture"
"wtec-i6zq","Traffic Volumes for 2016","map","Average daily weekday traffic (ADWT) is the average number of vehicles in 24 hours adjusted for seasonal variation to represent the average weekday. The numbers on this map are two-way totals.","2023-02-01T15:39:33.000Z",3724,"Transportation/Transit"
"ttzx-ucsp","Green cart collection days","map","To look up your address, download a calendar, or get a reminder for your next pickup date, visit:  <a href=""http://www.calgary.ca/UEP/WRS/Pages/Garbage-collection-information/Residential-services/Garb","2026-05-22T23:43:07.000Z",3687,"Services and Amenities"
"xrct-ap62","Off Leash Dog Area Locations","map","Calgary has over 150 public off-leash areas in our multi-use parks. In total there are more than 1,250 hectares of off-leash space for Calgarians and their dogs to enjoy. Related information: Off leas","2026-05-22T17:01:33.000Z",3683,"Recreation and Culture"
"tvyg-5cd2","Secondary Suites Data Lens","story","<div>This dataset contains information about approved secondary suites in The City of Calgary. It can be viewed on an interactive map at <a href=""http://secondarysuites.calgary.ca/"" rel=""nofollow nore","2024-07-25T13:27:04.226Z",3679,NA
"veiy-ak8d","Parcel Address Points and Zoning","map","This file contains address information for land parcels within The City of Calgary.","2026-05-21T14:07:54.000Z",3670,"Base Maps"
"kp44-4n8q","Plus 15","map","This dataset shows the plus fifteen walkways located in downtown Calgary","2026-05-07T14:50:49.000Z",3646,"Transportation/Transit"
"d88m-6ky3","Assessment Review Board Decisions from Year to Year","filter","This data set contains information on decisions made by the Assessment Review Board (ARB). For more information on ARB decisions go to: https://arb.calgary.ca/eCourtPublicCarb/?q=node/414","2026-04-01T21:12:09.000Z",3611,"Government"
"czmc-jn59","School locations Data Lens","story","<div>Calgary school locations. Data provided by CBE, CSSD, and provincial school data.<br></div>","2023-08-02T17:57:03.201Z",3601,NA
"wawk-kcjq","Short term rentals data lens","story","","2024-01-03T17:17:20.328Z",3567,NA
"5843-8tyj","Assessment Subproperty Use Codes","dataset","Descriptions of the various subproperty use codes for Assessment.
*For Property Assessment data, please visit <a href=""https://data.calgary.ca/Government/Property-Assessments/6zp6-pxei"">Property Asses","2026-01-14T14:02:59.000Z",3561,"Help and Information"
"ya5i-ih8w","Builders Report - One and Two Family","filter","","2026-05-23T19:03:30.000Z",3545,"Business and Economic Activity"
"eymx-4za9","Tree Canopy 2020","dataset","Tree Canopy contains polygons outlining the extent of tree cover for all land within the City of Calgary. The tree canopy was derived by Remote Sensing software using City of Calgary Orthophotos and L","2026-05-19T19:15:39.000Z",3529,"Environment"
"arf6-qysm","311 Service Requests - Current Year","dataset","Public Service Requests submitted via 311 in the current year. A dataset containing Service Requests from 2012 to present is available here: https://data.calgary.ca/Services-and-Amenities/311-Service-","2026-05-24T14:34:07.000Z",3508,"Services and Amenities"
"p2fv-5peq","Waste Composition 2019 - Garbage","dataset","Waste Composition studies are periodically conducted by Waste and Recycling Services to help assess the performance of diversion and education programs and inform improvements and new program design. ","2025-12-22T15:54:16.000Z",3506,"Help and Information"
"diep-5icr","Traffic incidents timeline","chart","An archive of traffic incidents within Calgary updated every 10 minutes. Please note there may be gaps in the data due to system or script malfunction. For more information, see the <a href=""http://ww","2026-05-24T16:11:03.000Z",3506,"Transportation/Transit"
"qndb-27qm","Parks Pathways","dataset","The Calgary Pathways dataset identifies regional and local pathways that offer connectivity throughout the City.The map is also available in the following formats: paper hardcopy, electronic, and the ","2026-05-21T14:16:43.000Z",3489,"Recreation and Culture"
"aqzn-tb7a","Abandoned Shopping Carts Map","map","Information about abandoned shopping carts on public property, including their locations and brand details when available, based on active 311 service requests.","2026-05-23T17:01:07.000Z",3481,"Services and Amenities"
"xmep-aasr","Schools in Communities","map","Calgary school locations.  Data provided by CBE, CSSD, and provincial school data.","2026-05-01T12:30:55.000Z",3474,"Services and Amenities"
"g53d-yj3y","Citywide Land Cover Classification Map","map","","2026-03-11T22:23:56.000Z",3462,"Environment"
"cqsb-2hhg","Fire Stations","dataset","Fire Station locations for the City of Calgary","2026-05-01T17:06:28.000Z",3461,"Health and Safety"
"i3cn-7kge","Development Permits by Ward - current year","map","Applications for development permits in Calgary. For more information on the development permit process visit <a href=""http://www.calgary.ca/PDA/pd/Pages/Permits/Development-permits/Development-Permit","2026-05-23T21:10:14.000Z",3459,NA
"2x64-b5gw","Landfill Setbacks","map","These maps provide landfill setback information as defined under the Municipal Government Act (MGA) Subdivision and Development Regulation (SDR) Landfill Setback (Section 13) from a City of Calgary La","2023-02-01T15:39:36.000Z",3454,"Environment"
"vb9x-684u","Recreation Facilities Map","map","Names and addresses for recreation facilities.  Includes amenities available at each location.","2026-05-22T18:42:04.000Z",3442,"Recreation and Culture"
"sqfh-d2dp","Flood extents from June 22, 2013","dataset","The flood extents line was manually delineated from an aerial photo taken on June 22, 2013, and does not represent the peak or maximum flood extents during the June 2013 flood event. This aerial photo","2023-02-01T15:39:46.000Z",3442,"Environment"
"3bxb-hhuj","Air Quality Index over time","chart","This dataset makes historical air quality data accessible for various parameters at Calgary monitoring stations. The data is collected by the Calgary Regional Airshed and Alberta Environment and Parks","2024-11-25T21:37:26.000Z",3428,"Environment"
"rh7p-2ad8","2016 Census of Canada - Top 5 Languages spoken most often at home by Community","dataset","This is Statistics Canada collected census data for 2016. The data refers only to the population in private households. Residents of collective dwellings (dwellings of a commercial, institutional or c","2023-02-01T15:38:53.000Z",3422,"Demographics"
"xsym-tc2c","2018 Traffic Volume Flow Map","map","The traffic volume flow map illustrates the Average Annual Weekday Traffic (AAWT), the average number of vehicles in 24 hours adjusted for seasonal variation to represent the average weekday. The numb","2023-02-01T15:39:29.000Z",3399,"Transportation/Transit"
"eaex-8bh9","Fire Response Time","dataset","This dataset contains percentage of first-in units to arrive at the scene of fire within seven minutes.","2023-02-01T15:38:51.000Z",3398,"Government"
"ntmc-5ss8","Calgary Equity Index - Median Income","map","The Calgary Equity Index Overlay Statistics are derived from Citizen Satisfaction surveys and census demographics.
The Calgary Equity Index is a decision-making tool designed to measure equity in Cal","2023-02-01T15:38:58.000Z",3394,"Demographics"
"9ew3-n6xb","Air Quality Index","filter","This dataset makes historical air quality data accessible for various parameters at Calgary monitoring stations. The data is collected by the Calgary Regional Airshed and Alberta Environment and Parks","2025-02-28T21:13:52.000Z",3374,"Environment"
"twji-yez2","2019 Traffic Volume Flow Map","map","The traffic volume flow map illustrates the Average Annual Weekday Traffic (AAWT), the average number of vehicles in 24 hours adjusted for seasonal variation to represent the average weekday. The numb","2024-06-17T20:52:39.000Z",3322,"Transportation/Transit"
"j7mp-h975","Water Single Family Consumption","dataset","This dataset contains single family includes consumption of metered and flat rate customers living in detached homes and duplexes.","2023-02-01T15:39:47.000Z",3303,"Government"
"p84b-7zbi","Assessments by Community","dataset","This dataset contains assessment accounts and value by community","2026-01-09T20:24:21.000Z",3265,"Government"
"egie-vqqc","Compensation Disclosure List 2024","filter","The City’s compensation disclosure list includes position titles and base salary ranges as approved by Council in 2024.

For more information see: <a href=""https://www.calgary.ca/ca/city-manager/compe","2026-04-23T22:41:22.000Z",3253,"Government"
"fqax-i3nz","Calgary Open Budget","dataset","The City of Calgary creates a four-year budget that is updated annually to reflect the changing needs and priorities of Calgarians. This dataset provides detailed budget information for the 2023 – 202","2026-01-15T16:19:06.000Z",3252,"Government"
"iepb-ykvd","Annual Economic Indicators","dataset","This annual report contains comments, analysis and statistical illustrations of a set of economic indicators monitored by Corporate Economics that inform our forecasts.","2026-05-22T10:01:47.000Z",3234,"Business and Economic Activity"
"ewnu-a9q4","Ward Map of Calgary Business Licences","map","This file includes the licensed businesses in the City of Calgary. Data fields include: Trade name, Business Location, Creation Date, Status, Licence Type and Community District of the business. All b","2026-05-24T05:14:53.000Z",3215,"Business and Economic Activity"
"i6vk-zby9","Top 10 Licensed dog breeds chart (Last 90 days)","chart","Dog breed information is reported by dog owner upon licensing. Calgary Animal Services does not verify breed info or require proof of breed when collecting this information. Breed info data collected ","2026-05-12T20:06:53.000Z",3208,"Demographics"
"pai2-tsju","Community Sectors Map","map","Derived from the Community Boundaries, this dataset shows the sectors and what communities are within those sectors","2026-05-19T19:21:45.000Z",3175,"Base Maps"
"r5yb-55ut","Map of flood extents from June 22, 2013","map","The flood extents line was manually delineated from an aerial photo taken on June 22, 2013, and does not represent the peak or maximum flood extents during the June 2013 flood event. This aerial photo","2023-02-01T15:39:47.000Z",3160,"Environment"
"s8t8-5gi9","Builders Report - Multi Family","filter","","2026-05-23T19:03:30.000Z",3135,"Business and Economic Activity"
"mz2j-7eb5","Community Sectors","dataset","Derived from the Community Boundaries, this dataset shows the planning sectors and what communities are within those sectors","2026-05-19T19:30:15.000Z",3075,"Base Maps"
"aphy-m9us","Primary Electricity Usage","chart","Energy consumption at City facilities. This raw data is subject to periodic adjustments and modifications.","2026-05-01T11:36:02.000Z",3068,"Environment"
"tsqf-wjr5","Calgary Health Clinics and Hospitals","map","In this model amenities are classified under the following headings: Attractions, Community Centre, Court, Defibrillator, Health Clinic, Hospital, Internet Access, Library,  Skate Parks, Social Dev Ct","2026-05-19T21:13:23.000Z",3050,"Services and Amenities"
"dv2f-necx","Intersection Safety Cameras","dataset","Intersection Safety Cameras (ISCs) are cameras that detect the travel speed of vehicular traffic. The ISC is also able to detect whether a vehicle fails to stop for the red light phase in a signalized","2026-05-13T19:36:34.000Z",3042,"Health and Safety"
"4mgk-hrwr","Historical Calgary Community Populations","chart","The population, occupied dwelling count, and person per unit calculation of Calgary communities since 1968. <br /><br />These data are collected from different sources and may be based on community bo","2026-05-06T15:24:22.000Z",3028,"Demographics"
"h8cb-dpp3","2023 Traffic Volume Flow Map","map","Average Daily Weekday Traffic (ADWT) is the average number of vehicles in 24 hours adjusted for seasonal variation to represent the average weekday. The number on this map represents two-way totals.
V","2024-06-17T21:19:39.000Z",3012,"Transportation/Transit"
"btc8-9kef","Citizen Satisfaction Survey (2018-2021)","dataset","These are the results of the 2018 to 2021 Citizen Satisfaction survey. To see the most recent reports, visit <a href=""https://calgary.ca/citizensatisfaction"">Calgary.ca/citizensatisfaction</a>.

For d","2026-01-28T18:06:20.000Z",2998,"Help and Information"
"vuyp-sbjp","Traffic Counts at Permanent stations","dataset","Permanent counts stations are used in trend analysis of traffic patterns around the city.  The stations allow us to create seasonal and weekly variations for traffic data so that we can normalize any ","2025-10-15T06:02:54.000Z",2985,"Transportation/Transit"
"vnha-3kkk","Quality of life indicators","dataset","Partial data for select quality of life indicators","2023-02-01T15:39:19.000Z",2979,"Government"
"4286-vnsg","Historical Community Populations and Dwelling Counts","chart","The population, occupied dwelling count, and person per unit calculation of Calgary communities since 1968. <br /><br />These data are collected from different sources and may be based on community bo","2026-05-06T16:00:39.000Z",2972,"Demographics"
"vxxi-pm4v","Year To Date Economic Indicators","dataset","This monthly report contains comments, analysis and statistical illustrations of a set of economic indicators monitored by Corporate Economics that inform our forecasts.","2026-05-22T10:01:27.000Z",2943,"Business and Economic Activity"
"ntse-tznh","1:10 Flood Map (10% chance of occurring in any year)","dataset","(Note: Updated inundation maps for 1:2 to 1:1000 floods are available from Alberta Environment and Parks (2020). The new draft maps can be viewed here: https://floods.alberta.ca/?app_code=FI&mapType=D","2023-06-12T20:05:06.000Z",2942,"Environment"
"5qgc-b482","Water Hydrants","dataset","This dataset shows true location of City-owned water hydrants in City of Calgary. The hydrant location is at the end of a hydrant lead connected to water pipe. For more information visit http://www.ca","2026-05-22T19:40:11.000Z",2915,"Health and Safety"
"himp-urp7","Traffic Incidents Archive 2017","dataset","An archive of traffic incidents within The City of Calgary. The data source is checked every 10 minutes for updates. See Source URL for RSS feed of current incidents.","2023-02-01T15:39:29.000Z",2876,"Transportation/Transit"
"gtyk-57ky","Municipal Development Plan Urban Structure","dataset","Municipal Development Plan Map 1.
The geospatial information used to create the Municipal Development Plan (MDP) maps is intended for visualization at a citywide scale. The maps provide both direct a","2023-02-01T15:39:27.000Z",2867,"Base Maps"
"d3ez-qhmr","2026 Budget","chart","The City of Calgary creates a four-year budget that is updated annually to reflect the changing needs and priorities of Calgarians. This dataset provides detailed budget information for the 2023 – 202","2026-01-15T16:19:47.000Z",2866,"Government"
"nfvn-x8e2","Waste and Recycling Services Performance Measures","dataset","Waste & Recycling Performance Measures are used to assess the performance of The City of Calgary's Waste & Recycling service.  Five measures have been approved for the 2023-2026 Service Plans and Budg","2026-05-13T22:25:09.000Z",2858,"Help and Information"
"8mci-3bzr","Micromobility Locations","dataset","This dataset is an extraction from the following publicly accessible feeds:
Neuron:
https://mds-global-yyc.neuron-mobility.com/gbfs/2/en/free_bike_status
Bird:
https://mds.bird.co/gbfs/platform-partne","2026-05-24T17:33:23.000Z",2855,"Transportation/Transit"
"xesp-3jc3","Public Sanitary Service Lines","dataset","A sanitary service pipe, also known as a sanitary service line, is the way wastewater leaves each home in Calgary. The sanitary service pipe can be thought of as two sections:
(1) From the sanitary ma","2026-05-01T22:03:59.000Z",2817,"Services and Amenities"
"vchq-db2i","Bridges","dataset","The City of Calgary currently maintains approximately 400 traffic, pedestrian and LRT bridges, as well as subways and tunnels.","2026-05-05T13:07:25.000Z",2798,"Transportation/Transit"
"bxgr-t8xb","Ward Boundaries for 2021 October 18 General Election","dataset","Ward boundaries have been updated for the 2021 General Election. These boundaries will not come into effect until Election Day October 18, 2021.","2026-04-08T17:14:26.000Z",2795,"Government"
"hfwb-eab8","Census by Community 2016","dataset","Census data is an official count of dwelling units and population within those units. The data is physically collected and may be supplemented with other information such as the periodic age/gender di","2026-04-06T16:18:15.000Z",2761,"Demographics"
"vt3t-jpfj","Streetlight Poles","dataset","This dataset was created for visually locating streetlight poles.","2026-05-05T13:06:40.000Z",2754,"Health and Safety"
"a3ya-gwgt","Micromobility Locations in Calgary","map","This dataset is an extraction from the following publicly accessible feeds:

Neuron:
https://mds-global-yyc.neuron-mobility.com/gbfs/2/en/free_bike_status

Bird:
https://mds.bird.co/gbfs/platform-part","2026-05-24T16:18:22.000Z",2749,"Transportation/Transit"
"wi52-6nx6","Top 100 Licensed Dog Breeds","dataset","Dog breed information is reported by dog owner upon licensing. Calgary Animal Services does not verify breed info or require proof of breed when collecting this information. Breed info data collected ","2026-05-12T20:06:53.000Z",2740,"Demographics"
"ikeb-n5bc","Parks Seating","dataset","Identifies the types of Seating maintained by Calgary Parks or located on lands under Calgary Parks Stewardship.  Seating types include parks and memorial benches, picnic tables, bleachers, and games ","2026-05-21T14:11:32.000Z",2726,"Recreation and Culture"
"hk5h-uv5k","311 Call Centre","dataset","This dataset contains the daily 311 call center activity","2023-02-01T15:39:18.000Z",2713,"Government"
"mmhp-hpsq","Traffic Incidents Archive 2016","dataset","Traffic incidents within The City of Calgary updated every 30 minutes. See Source URL for RSS feed which updates every 10 minutes.","2023-02-01T15:39:29.000Z",2711,"Transportation/Transit"
"n6v5-frqe","Parks Seating - West-facing wooden benches to watch the sunset","map","Identifies the types of Seating maintained by Calgary Parks or located on lands under Calgary Parks Stewardship.  Seating types include parks and memorial benches, picnic tables, bleachers, and games ","2026-05-21T14:11:32.000Z",2703,"Recreation and Culture"
"bdu9-amk8","Playground Equipment","dataset","Playground equipment maintained by Calgary Parks or located on lands under Calgary Park’s stewardship.","2026-05-22T17:32:07.000Z",2693,"Recreation and Culture"
"tz8z-hyaz","Ward Boundaries","dataset","A ward is the division of the city into electoral areas, each represented by one elected Councillor. Wards are a geographical division of the municipality and are referred to by a number defined in th","2026-05-01T14:03:22.000Z",2692,"Government"
"jw79-78tx","Calgary Park and Bike Sites","dataset","Avoid downtown parking fees, exercise regularly, bypass traffic congestion, and discover Calgary's river pathways and bikeways. Seven Park and Bike sites are located five to eight kilometres from down","2023-02-01T15:39:31.000Z",2684,"Transportation/Transit"
"y7nv-njqa","Parks Water Bodies Map","map","This dataset identifies the Natural Water Bodies on lands under Calgary Parks Stewardship. It can be a flowing type of water i.e. STREAM or some type of body of water i.e. NATURAL POND.  Types of WATE","2026-05-05T14:00:46.000Z",2674,"Environment"
"kgh7-mhue","Citizen Satisfaction Survey (2016-2017)","dataset","These are the results of the 2016 & 2017 Citizen Satisfaction survey. To see the most recent reports, visit <a href=""https://calgary.ca/citizensatisfaction"">Calgary.ca/citizensatisfaction</a>.

For de","2026-01-28T18:05:49.000Z",2673,"Help and Information"
