"soda_id","title","type","description","updated_at","page_views_total","domain_category"
"5yff-va5a","Road Marking Lines","dataset","This dataset was created for visually locating road marking lines and designs.","2026-05-22T16:02:22.000Z",1797,"Transportation/Transit"
"wnys-g3eq","Road Marking Lane Widths","dataset","This dataset was created for visually locating lane width on road marking designs.","2026-05-22T22:31:54.000Z",1796,"Transportation/Transit"
"dpia-2gub","Trails","map","The Calgary Trails dataset identifies designated and undesignated trails throughout the City network. Dataset may not contain all trails within Calgary","2026-05-21T14:17:14.000Z",1789,"Recreation and Culture"
"7v8c-cjjm","Parks Amenity Equipment","dataset","Park amenities maintained by Calgary Parks or located on lands under Calgary Park’s stewardship.","2026-05-21T14:11:07.000Z",1774,"Recreation and Culture"
"4dt7-fpja","Business Improvement Areas","map","Detailed polygons outlining the Business Improvement Areas (formerly Business Revitalization Zones) in Calgary. The mission of a BIA is to:
•	Improve, beautify, and maintain property in the business ","2026-05-01T13:32:11.000Z",1759,"Business and Economic Activity"
"qwju-mqym","City Planning Sectors","dataset","City Planning Sectors are defined by groupings of community districts and/or transportation zones making up the Center, North, Northeast, East, Southeast, South, West and Northwest Sectors. Planning S","2026-05-06T14:29:53.000Z",1738,"Base Maps"
"6qn4-9vc6","Neighbourhood Speed Limits","dataset","This dataset describes proposed speed limits on Collector and Residential roads as per the new default speed limit bylaw within the City of Calgary that takes effect May 31, 2021.
To view finalized, c","2023-02-01T15:39:28.000Z",1724,"Transportation/Transit"
"jzfi-qvb4","2021 Federal Census Families and Households by Ward","dataset","The Families and Households data from the 2021 Federal Census covers household, household size, census family, and marital status. For questions, please contact socialresearch@calgary.ca. Please visit","2024-10-11T18:42:45.000Z",1723,"Demographics"
"aggn-khkx","City of Calgary Bylaws","dataset","The Municipal Government Act grants Council the power to pass bylaws. Bylaws are created as a way to address issues and concerns of the local community. They are created to protect the environment, pu","2026-05-01T15:50:26.000Z",1722,"Government"
"mngv-ufjz","Regulatory Flood Hazard Map Steplines","dataset","Step lines define the regulatory flood elevation levels within the floodway/flood fringe. The official designated flood elevation indicated by the text applies within the section of the river between ","2026-05-07T15:47:38.000Z",1717,"Environment"
"9tye-m3na","Calgary Seniors Directory Data Lens","story","<div>This dataset contains a list of services for Calgary seniors.<br></div>","2023-08-16T20:06:26.532Z",1715,NA
"duxj-44dv","City Planning Sectors Map","map","City Planning Sectors are defined by groupings of community districts and/or transportation zones making up the Center, North, Northeast, East, Southeast, South, West and Northwest Sectors. Planning S","2026-05-06T14:59:43.000Z",1702,"Base Maps"
"vjby-bq38","Capital Budget ($M)","chart","The City of Calgary creates a four-year budget that is updated annually to reflect the changing needs and priorities of Calgarians. This dataset provides detailed budget information for the 2023 – 202","2026-01-14T23:38:24.000Z",1699,"Government"
"a3cq-4yfn","Employment Rates","chart","This annual report contains comments, analysis and statistical illustrations of a set of economic indicators monitored by Corporate Economics that inform our forecasts.","2026-05-22T10:01:47.000Z",1692,"Business and Economic Activity"
"ctxu-aicd","Bridge map","map","The City of Calgary currently maintains approximately 400 traffic, pedestrian and LRT bridges, as well as subways and tunnels.","2026-05-05T13:07:25.000Z",1685,"Transportation/Transit"
"7ta2-pupq","Civic census 2016 - Modes of Travel to Work","dataset","Trends in Calgarians’ choices for travelling to work, and to determine if major infrastructure changes have resulted in a change in behaviour.","2023-02-01T15:39:33.000Z",1681,"Transportation/Transit"
"enr4-crti","Parks Off Leash Areas","dataset","Calgary has over 150 public off leash dog areas in our multi-use parks. In total there are more than 1,250 hectares of off-leash space for Calgarians and their dogs to enjoy. Related information: Off ","2026-05-22T17:01:33.000Z",1679,"Recreation and Culture"
"yrm5-fijg","Number of public trees, by community","map","Information about Calgary's urban forest, including the locations and types of trees on public land. To learn more, visit the <a href=""https://maps.calgary.ca/TreeSchedule/"">Urban Forest Management ma","2026-05-22T21:11:10.000Z",1678,"Environment"
"cqiv-q7en","Accessible Pedestrian Traffic Signals","map","This dataset contains the locations of traffic signals that are maintained by the City of Calgary. For more information, see http://www.calgary.ca/Transportation/Roads/Pages/Traffic/Traffic-signals-an","2026-05-24T11:00:38.000Z",1677,"Health and Safety"
"fu7z-c7ar","Plus 15 Bridges","dataset","Bridges within Calgary's Plus 15 Network. For more information visit <a href=""https://www.calgary.ca/plus15"">Calgary.ca/Plus15</a>","2026-05-01T17:00:46.000Z",1677,"Transportation/Transit"
"nbta-7ws9","Prosperous City Indicators","dataset","","2023-02-01T15:39:19.000Z",1672,"Government"
"39t3-dqne","Calgary.ca Web Analytics Top Downloads Past 30 Days","dataset","The top 100 files downloaded from City of Calgary web pages over the past 30 days.","2026-05-23T07:01:04.000Z",1663,"Help and Information"
"wyyc-63e5","Green Line Alignment","dataset","Green Line alignment as depicted at <a href=""https://www.calgary.ca/greenline"">Green Line LRT.</a>","2026-05-22T16:31:44.000Z",1662,"Transportation/Transit"
"65wd-2exm","Industrial, Commercial, and Institutional Garbage Composition","filter","This dataset is for garbage bin waste from the Industrial, Commercial, and Institutional (ICI) sector. The North American Industry Classification System (NAICS) is used to categorize ICI businesses an","2025-02-28T21:13:50.000Z",1644,"Help and Information"
"5eng-mjuy","Central Business District Cordon Count 2015","dataset","Every year in May, The City conducts the Central Business District (CBD) cordon count. The cordon count is performed at 31 locations around the CBD over a three week time period, collecting data on ho","2023-02-01T15:39:31.000Z",1637,"Transportation/Transit"
"6zvc-wgqp","Alcohol in the Park Boundaries","dataset","Boundaries for the 2022 Alcohol in the Park Project for the public web map. 
See <a href=""https://www.calgary.ca/csps/parks/programs/alcohol-in-parks.html"">Alcohol in Parks</a> for more information.","2026-05-24T00:24:15.000Z",1634,"Services and Amenities"
"hxeu-d57b","Central Business District Cordon Count 2014","dataset","Every year in May, The City conducts the Central Business District (CBD) cordon count. The cordon count is performed at 31 locations around the CBD over a three week time period, collecting data on ho","2023-02-01T15:39:31.000Z",1632,"Transportation/Transit"
"7jum-ynic","School Enrolment by School Authority Timeline Chart","chart","Annual student enrolment from ECS to Grade 12 throughout Calgary.
This data is a subset of the entire data for Alberta. The original dataset is on the Government of Alberta (https://open.alberta.ca/op","2025-03-06T17:44:36.000Z",1619,"Demographics"
"7tax-5vsg","Habitat","dataset","Identifies the plant communities and environments within the Natural areas maintained by Calgary Parks or located on lands under Calgary Parks Stewardship.","2026-05-21T14:21:57.000Z",1611,"Environment"
"x35s-9dsu","Traffic incidents in Wards","map","An archive of traffic incidents within Calgary updated every 10 minutes. Please note there may be gaps in the data due to system or script malfunction. For more information, see the <a href=""http://ww","2026-05-24T16:11:03.000Z",1606,"Transportation/Transit"
"dmrk-q4ck","Calgary.ca Web Analytics Past 7 Days","dataset","The top 100 City of Calgary web pages based on visits over the past 7 days.","2026-05-23T07:00:45.000Z",1601,"Help and Information"
"fuea-eg5z","Snow and Ice Clearing Priority Routes Map","map","Snow clearing for Priority 1 (major roads such as Crowchild Trail, Glenmore Trail, Memorial Drive, 16 Avenue) and Priority 2 routes (collector roads, major community access roads, bus routes etc.)
Pr","2026-05-01T20:33:47.000Z",1599,"Health and Safety"
"a5xs-5b3q","Compensation Disclosure List 2018","filter","The City’s compensation disclosure list includes position titles and base salary ranges as approved by Council in 2014.

For more information see http://www.calgary.ca/CA/cmo/Pages/Compensationdiscl","2025-06-18T14:02:32.000Z",1594,"Government"
"qpfd-c3pc","Operating Expenditures ($M)","chart","The City of Calgary creates a four-year budget that is updated annually to reflect the changing needs and priorities of Calgarians. This dataset provides detailed budget information for the 2023 – 202","2026-01-14T23:38:24.000Z",1588,"Government"
"tfmd-grpe","Parks Trails","dataset","The Calgary Trails dataset identifies designated and undesignated trails throughout the City network. Dataset may not contain all trails within Calgary","2026-05-21T14:17:14.000Z",1580,"Recreation and Culture"
"q4c9-ekgw","Calgary Public Library Catchment Areas","map","Identifies the catchment areas for the Calgary Public Library.","2023-02-01T15:39:25.000Z",1578,"Base Maps"
"q65a-qvjx","Calgary Equity Index - Indicator Values by CSA","chart","The Calgary Equity Index is a decision-making tool designed to measure equity in Calgary, based on a social determinant of health (SDOH) framework. The SDOH are the range of interacting social and eco","2023-02-01T15:38:53.000Z",1567,"Help and Information"
"trut-zy5v","Abandoned Shopping Carts","dataset","Information about abandoned shopping carts on public property, including their locations and brand details when available, based on active 311 service requests.

Your personal information is being col","2026-05-24T17:02:05.000Z",1564,"Services and Amenities"
"79kr-ktsi","Dynamic Message Signs (DMS) – Live Report","dataset","Dynamic Message Signs (DMS) – Live Report 
Locations and current messages of Dynamic Message Signs (DMS) in Calgary, updated every 5 minutes.
This dataset provides near real-time information from the ","2026-05-24T17:42:10.000Z",1563,"Transportation/Transit"
"beky-kpay","Block Profile Points","dataset","A Block Profile is a detailed engineering drawing of a record containing features within a public right-of-way. 
This dataset represents the center points of areas that are stored in block profile ima","2026-05-24T06:55:28.000Z",1559,"Help and Information"
"b6h5-4vq7","City of Calgary Events Map","map","Map of events happening in and around Calgary.","2026-05-24T06:20:31.000Z",1558,"News and Events"
"isek-k4ja","2021 Federal Census Employment by Community","dataset","The Employment data from the 2021 Federal Census covers labour force status, employment status, labour force participation rate, industry, and occupation. For questions, please contact socialresearch@","2024-10-11T18:39:55.000Z",1558,"Demographics"
"s9g3-2u2e","Citizen Satisfaction Survey - Perception of Services","dataset","Since 1997, The City of Calgary has conducted its annual Citizen Satisfaction Survey to ask Calgarians how satisfied they are with City performance, programs, services, and overall quality of life in ","2026-01-28T18:07:27.000Z",1556,"Services and Amenities"
"sebe-fds7","2016 Census of Canada - Country of birth of immigrants","dataset","This is Statistics Canada collected census data for 2016. The data refers only to the population in private households. Residents of collective dwellings (dwellings of a commercial, institutional or c","2023-02-01T15:38:53.000Z",1554,"Demographics"
"q6ss-6wna","Central Business District Cordon Count 2021","dataset","Every year in May, The City conducts the Central Business District (CBD) cordon count. The cordon count is performed at 31 locations around the CBD over a four week time period, collecting data on how","2023-02-01T15:39:31.000Z",1553,"Transportation/Transit"
"eqqb-ptfa","Annual wildlife sightings requests","chart","Public Service Requests submitted via 311 from 2012 to present. 

For more information on 311 Calgary, or to submit a request, visit http://www.calgary.ca/CFOD/CSC/Pages/311.aspx","2026-05-23T17:01:11.000Z",1547,"Services and Amenities"
"vkin-p7cs","2025 CCSD By-election official results","dataset","Official results for the January 31, 2025 Calgary Catholic School District (CCSD) By-election to elect two trustees to represent Wards 4 & 7 and Wards 11 & 12 for the remainder of the 2021-2025 term. ","2026-04-01T18:40:17.000Z",1540,"Government"
"fbvs-aj5g","Public Bicycle Parking","dataset","The CPA is offering monthly bicycle parking at most of its parkades. Our secured bicycle parking locations are equipped with a bicycle repair stand and tools that customers can use for free. Bicycle t","2023-02-01T15:39:32.000Z",1538,"Transportation/Transit"
"86mc-9jh2","Police Districts","dataset","Each District has a district office. These districts can be used to calculate information submitted by investigators on criminal activity. The crime statistics can be used to develop crime prevention ","2026-05-19T22:12:23.000Z",1537,"Health and Safety"
"ga6m-7k2i","Civic Census by Ward, Age and Gender","dataset","Ward-level tabulations of annual census counts of residents categorized by age group and gender. Ward boundaries can change over time. These results are based on the ward boundaries at the time of dat","2026-04-07T19:14:48.000Z",1532,"Demographics"
"wgr2-8nr5","2025 CCSD By-election Cumulative Results for wards 4&7","chart","Final results of the 2025 CCSD By-election. Results for Separate School Board Trustee broken down by ward and voting station for Election Day. Advance Vote and care facilities/shelter votes are cumula","2025-03-21T15:23:18.000Z",1532,"Government"
"7mc8-zqjc","Riparian Areas - Variable Width","dataset","Identifies variable width biophysical riparian areas along major rivers and streams in Calgary, as of 2012. Four separate riparian zones are delineated: Inner Riparian, Middle Riparian, Outer Riparian","2023-02-01T15:39:47.000Z",1532,"Environment"
"2tzz-grag","2024 Mid-Year Progress Report - Performance Measures","dataset","The City of Calgary's 2024 Mid-Year Progress Update provides an overview of our achievements and challenges during the first half of the year as we continue implementing the 2023-2026 Service Plans an","2026-05-04T20:50:17.000Z",1524,"Business and Economic Activity"
"dxy9-fuxx","Calgary Equity Index Demographics","chart","The Calgary Equity Index Overlay Statistics are derived from Citizen Satisfaction surveys and census demographics. 
The Calgary Equity Index is a decision-making tool designed to measure equity in Ca","2023-02-01T15:38:53.000Z",1522,"Demographics"
"x5fq-4wz6","Census Districts (effective October 16, 2017)","map","The City is divided into small areas, which are called Census Districts. The average Census District is between 400 and 600 dwelling units, however, some size differences occur, particularly in growin","2026-04-07T17:25:52.000Z",1520,"Government"
"e6xg-kaxf","Communities by Sector","map","The set of community points. Each point identifies the centroid of the community it is located in.","2026-02-19T21:56:56.000Z",1517,"Base Maps"
"pqfd-saqa","Police Zones","map","Zones are smaller sub areas located within Police Districts. Zones are then broken down into geocode areas. Zones may be used for crime analysis.","2025-06-01T22:52:08.000Z",1507,"Health and Safety"
"iy5g-c24u","Calgary Emergency Shelters Occupancy Data Lens","story","","2023-08-16T21:01:56.493Z",1506,NA
"p7ka-hqjn","Shelter Utilization (Capacity and Usage)","chart","This is a dataset of Calgary area emergency shelter occupancy. It is sourced from the provincial open data source provided by Community and Social Services, and content is limited to Calgary-area shel","2026-05-01T22:30:28.000Z",1500,"Services and Amenities"
"d52q-zsxs","Calgary Language Community Map","map","","2023-02-01T15:39:50.000Z",1495,NA
"pzc6-z5uz","Collection System Levels and Flows","dataset","This is data collected from the sanitary sewer system by area velocity type open channel flow meters.
*QAQC'd data that has been finalized is tagged as '1' under the Edited column.*
(CSV file download","2024-04-24T15:52:23.000Z",1495,"Services and Amenities"
"n52m-2ku5","Central Business District Cordon Count 2012","dataset","Every year in May, The City conducts the Central Business District (CBD) cordon count. The cordon count is performed at 31 locations around the CBD over a three week time period, collecting data on ho","2023-02-01T15:39:31.000Z",1495,"Transportation/Transit"
"4v8s-3kss","Snow and Ice Clearing Priority Routes","dataset","Snow clearing for Priority 1 (major roads such as Crowchild Trail, Glenmore Trail, Memorial Drive, 16 Avenue) and Priority 2 routes (collector roads, major community access roads, bus routes etc.)
Pri","2026-05-01T20:33:47.000Z",1492,"Health and Safety"
"5tyb-x8qg","Short term rentals in Communities","map","This dataset shows all licenced Short Term Rental locations in the City of Calgary and its status. Data is provided weekly by The City of Calgary.","2026-05-24T10:51:00.000Z",1490,"Business and Economic Activity"
"fn2v-46sf","Development Permit Public Notices Data Lens","story","The Development Permit Public Notices data set consists of development permits which have been made public. The City of Calgary is required by law to publish Development Permit information for two wee","2023-08-16T21:08:02.923Z",1486,NA
"2icx-iwek","Suburban Residential Growth (SRG) Online Land Supply","dataset","This dataset provides units, hectares, and estimated future population of existing suburban residential land supply that is in various stages of development. It includes information regarding the plan","2026-05-07T14:32:56.000Z",1486,"Services and Amenities"
"syky-bjvh","Map of Corporate Structures","map","The Corporate Structures List (CSL) is a geospatial dataset designed to help users explore The City of Calgary's assets. The CSL contains essential information about structures owned, managed, leased,","2026-05-23T21:00:32.000Z",1484,"Government"
"9hbw-zj92","School Parking Zones","dataset","Locations of the Calgary Parking Authority School Parking Zones.","2026-05-01T13:05:12.000Z",1481,"Transportation/Transit"
"hvhm-v5dn","Airport Vicinity Protection Area","dataset","Airport Vicinity Protection Area (AVPA) boundary is a development constraint for properties that are within the boundary. In August 2021, changes were approved to the AVPA through a Ministerial Order.","2023-02-01T15:38:51.000Z",1478,"Business and Economic Activity"
"kc7y-cs4i","Alcohol in the Park Seating","dataset","Locations for the 2022 Alcohol in the Park Project for the public web map. 
See <a href=""https://www.calgary.ca/csps/parks/programs/alcohol-in-parks.html"">Alcohol in Parks</a> for more information.","2026-05-24T02:30:24.000Z",1474,"Services and Amenities"
"vxbk-4cwe","Census By Ward 2000","map","Census data is an official count of dwelling units and population within those units. The data is physically collected and may be supplemented with other information such as the periodic age/gender di","2026-04-06T17:23:04.000Z",1464,"Demographics"
"g2mp-fupf","Parks Hard Surface Areas","map","Includes parking lots, picnic areas, compounds, access roads, and decorative brick areas maintained by Calgary Parks or located on lands under Calgary Park’s stewardship.","2026-05-21T14:20:59.000Z",1464,"Recreation and Culture"
"j2r5-38ys","Playground Zones","map","This dataset identifies all active playground zones in the City of Calgary.","2026-05-01T09:32:43.000Z",1463,"Health and Safety"
"7pez-dhxh","Corporate Structures","dataset","The Corporate Structures List (CSL) is a geospatial dataset designed to help users explore The City of Calgary's assets. The CSL contains essential information about structures owned, managed, leased,","2026-05-23T21:00:32.000Z",1458,"Government"
"tbnt-vpik","Surface Water Quality Sonde Data - Monitoring Locations","map","This dataset is compiled from The City of Calgary’s in situ (in location) water quality monitoring program. In situ field measures are acquired from the deployment of unattended multi-parameter sondes","2026-05-01T18:10:35.000Z",1455,"Environment"
"4y6b-yvdc","Green Line Stations","dataset","Stations as depicted on the <a href=""https://www.calgary.ca/green-line/green-line-map.html"">Green Line Map.</a> 
Station locations approved by Council in 2017 June, but subject to change based on desi","2026-05-22T16:24:14.000Z",1452,"Transportation/Transit"
"idwr-zemx","Applications For Tenancy Change Report","map","","2026-05-24T13:10:29.000Z",1442,"Business and Economic Activity"
"8g4s-ug5f","Monthly Transit Operating Hours","chart","","2026-03-01T17:03:39.000Z",1438,"Transportation/Transit"
"bz9b-77jf","Solar Power Energy Utilization","chart","Energy consumption at City facilities. This raw data is subject to periodic adjustments and modifications.","2026-05-01T11:36:02.000Z",1432,"Environment"
"ii28-85m5","Central Business District Cordon Count 2023","dataset","Every year in May, The City conducts the Central Business District (CBD) cordon count. The cordon count is performed at ~ 30 locations around the CBD over a four week time period, collecting data on h","2023-12-04T15:51:12.000Z",1425,"Transportation/Transit"
"b5c5-rej2","Compensation Disclosure List 2020","filter","The City’s compensation disclosure list includes position titles and base salary ranges as approved by Council in 2020.

For more information see http://www.calgary.ca/CA/cmo/Pages/Compensationdiscl","2025-06-18T14:02:32.000Z",1425,"Government"
"mrbn-65ea","Community Services Map","map","In this model amenities are classified under the following headings: Attractions, Community Centre, Court, Defibrillator, Health Clinic, Hospital, Internet Access, Library,  Skate Parks, Social Dev Ct","2026-05-19T21:06:45.000Z",1424,"Services and Amenities"
"yi6d-a7q5","Policy Plan Boundaries","dataset","A policy plan boundary defines the area that is covered by a policy plan document. This includes Area Redevelopment Plans (ARP), Area Structure Plans (ASP), Community Plans, Regional Policy Plans, Reg","2026-05-01T06:36:12.000Z",1416,"Government"
"yfq8-sn8e","Voting Stations -2025","dataset","Voting station locations, valid for the 2025 General Election.","2026-04-08T15:52:49.000Z",1415,NA
"t2zu-59kf","2016 Census of Canada - Top 5 Languages spoken most often at home by Ward","dataset","This is Statistics Canada collected census data for 2016. The data refers only to the population in private households. Residents of collective dwellings (dwellings of a commercial, institutional or c","2023-02-01T15:38:53.000Z",1414,"Demographics"
"bvb5-ntsh","Census By Ward 2017","map","Census data is an official count of dwelling units and population within those units. The data is physically collected and may be supplemented with other information such as the periodic age/gender di","2026-04-07T16:38:41.000Z",1412,"Demographics"
"ns4k-q38k","Playground equipment map","map","Playground equipment maintained by Calgary Parks or located on lands under Calgary Park’s stewardship.","2026-05-22T17:32:07.000Z",1411,"Recreation and Culture"
"4j3a-tqdp","mdp","map","Calgary city limits","2026-05-01T06:02:05.000Z",1411,"Base Maps"
"dvig-zn6d","Civic Census by Ward","filter","Ward-level tabulations of annual census counts of residents, dwellings, and dwelling occupancy. Ward boundaries can change over time. These results are based on the ward boundaries at the time of data","2026-04-07T17:50:10.000Z",1408,"Demographics"
"8rfi-nymv","1:50 Flood Map (2% chance of occurring in any year)","dataset","(Note: Updated inundation maps for 1:2 to 1:1000 floods are available from Alberta Environment and Parks (2020). The new draft maps can be viewed here: https://floods.alberta.ca/?app_code=FI&mapType=D","2023-06-12T17:34:00.000Z",1406,"Environment"
"2bak-dk2r","Calgary.ca Web Analytics Past 30 Days","dataset","The top 250 City of Calgary web pages based on visits over the past 30 days.","2026-05-24T07:00:12.000Z",1405,"Help and Information"
"uj4k-cdzk","Parks Buildings","dataset","This dataset identifies selected building footprints located on lands under Calgary Parks Stewardship.","2026-05-05T15:06:30.000Z",1399,"Government"
"qseb-xcrr","Municipal Development Plan Primary Transit Network Points","dataset","Municipal Development Plan Map 2.
The geospatial information included in the Primary Transportation Network (PTN) map is intended for visualization at a citywide scale. The map provides both direct an","2023-10-31T20:52:31.000Z",1398,"Transportation/Transit"
"ce2e-dmnv","Assessments By Community Data Lens","story","","2023-08-02T17:28:54.532Z",1397,NA
"maew-f6tk","Lanelines","dataset","This dataset was created for visually locating lanelines.","2026-05-22T20:30:34.000Z",1392,"Health and Safety"
"kmts-cfkc","Tracks - LRT Centre Line","map","The centre line depiction for railway tracks used by the Calgary Transit LRT system (Light Rail Transit)","2026-05-01T18:14:12.000Z",1389,"Transportation/Transit"
"8gpx-dyin","Calgary Equity Index - Population","map","The Calgary Equity Index Overlay Statistics are derived from Citizen Satisfaction surveys and census demographics.
The Calgary Equity Index is a decision-making tool designed to measure equity in Cal","2023-02-01T15:38:56.000Z",1385,"Demographics"
